title,DOI
Progress in machine translation,
Statistical machine translation,
Neural machine translation: A review,
Machine translation,
A statistical approach to machine translation,
Machine translation: A brief history,
Evaluation of machine translation and its evaluation,
Google's neural machine translation system: Bridging the gap between human and machine translation,
Machine translation today,
Dual learning for machine translation,
Is machine translation ready yet?,
Approaches to machine translation,
Machine translation approaches: issues and challenges,
Human and machine translation,
The LRC machine translation system,
Theoretical Overview of Machine translation,
"Machine translation: past, present, future",
Machine translation for everyone,
Towards making the most of chatgpt for machine translation,
A survey of multilingual neural machine translation,
Machine translation: a view from the lexicon,
Europarl: A parallel corpus for statistical machine translation,
Translation skill-sets in a machine-translation age,
Tensor2tensor for neural machine translation,
Neural machine translation by jointly learning to align and translate,
Six challenges for neural machine translation,
Scaling neural machine translation,
"A survey of machine translation: Its history, current status and future prospects",
Ethics and machine translation,
Translation engines: techniques for machine translation,
